"journal","url","publisher","date"
"Journal of Addiction and Clinical Research","NAhttps://www.pulsus.com/journal-addiction-clinical-research.html","Pulsus Group",2022-08-11
"Journal of Aquaculture and Fisheries Management","NAhttps://www.pulsus.com/journal-aquaculture-fisheries-management.html","Pulsus Group",2022-08-11
"Journal of Animal Genetics Research","NAhttps://www.pulsus.com/journal-animal-genetics-research.html","Pulsus Group",2022-08-11
"Journal of Agriculture","NAhttps://www.pulsus.com/journal-agriculture.html","Pulsus Group",2022-08-11
"Applied Food Science Journal","NAhttps://www.pulsus.com/applied-food-science-journal.html","Pulsus Group",2022-08-11
"Anesthesiology Case Reports","NAhttps://www.pulsus.com/anesthesiology-case-reports.html","Pulsus Group",2022-08-11
"Journal of Blood Disorders and Treatment","NAhttps://www.pulsus.com/journal-blood-disorders-treatment.html","Pulsus Group",2022-08-11
"Journal of Behavioral Neuroscience","NAhttps://www.pulsus.com/journal-behavioral-neuroscience.html","Pulsus Group",2022-08-11
"Journal of Biomolecules and Biochemistry","NAhttps://www.pulsus.com/journal-biomolecules-biochemistry.html","Pulsus Group",2022-08-11
"Biomedical Engineering: Current Research","NAhttps://www.pulsus.com/biomedical-engineering.html","Pulsus Group",2022-08-11
"Current Research: Cardiology","NAhttps://www.pulsus.com/current-research-cardiology.html","Pulsus Group",2022-08-11
"Current Research: Integrative Medicine","NAhttps://www.pulsus.com/current-research-integrative-medicine.html","Pulsus Group",2022-08-11
"Journal of Cancer & Metastasis Research","NAhttps://www.pulsus.com/journal-cancer-metastasis-research.html","Pulsus Group",2022-08-11
"Journal of Clinical Biochemistry","NAhttps://www.pulsus.com/journal-clinical-biochemistry.html","Pulsus Group",2022-08-11
"Clinical Nephrology and Research","NAhttps://www.pulsus.com/clinical-nephrology-research.html","Pulsus Group",2022-08-11
"Clinical Cardiology Journal","NAhttps://www.pulsus.com/clinical-cardiology-journal.html","Pulsus Group",2022-08-11
"Journal of Child Psychology","NAhttps://www.pulsus.com/journal-child-psychology.html","Pulsus Group",2022-08-11
"Journal of Clinical Psychiatry and Neuroscience","NAhttps://www.pulsus.com/journal-clinical-psychiatry-neuroscience.html","Pulsus Group",2022-08-11
"Journal of Clinical Psychology and Cognitive Science","NAhttps://www.pulsus.com/journal-clinical-psychology-cognitive-science.html","Pulsus Group",2022-08-11
"Clinical Pharmacology and Toxicology Research","NAhttps://www.pulsus.com/clinical-pharmacology-toxicology-research.html","Pulsus Group",2022-08-11
"Journal of Child and Adolescent Psychiatry","NAhttps://www.pulsus.com/journal-child-adolescent-psychiatry.html","Pulsus Group",2022-08-11
"Journal of Clinical Microbiology and Infectious Diseases","NAhttps://www.pulsus.com/journal-clinical-microbiology-infectious-diseases.html","Pulsus Group",2022-08-11
"Journal of Clinical Diagnosis and Treatment","NAhttps://www.pulsus.com/journal-clinical-diagnosis-and-treatment.html","Pulsus Group",2022-08-11
"Chest and Lung Research","NAhttps://www.pulsus.com/chest-lung-research.html","Pulsus Group",2022-08-11
"Journal of Clinical Genetics and Genomics","NAhttps://www.pulsus.com/journal-clinical-genetics-genomics.html","Pulsus Group",2022-08-11
"Dentistry: Case Report","NAhttps://www.pulsus.com/dentistry-case-report.html","Pulsus Group",2022-08-11
"Journal of Drugs and Ecotoxicology","NAhttps://www.pulsus.com/journal-drugs-ecotoxicology.html","Pulsus Group",2022-08-11
"Journal of Environmental Chemistry and Toxicology","NAhttps://www.pulsus.com/journal-environmental-chemistry-toxicology.html","Pulsus Group",2022-08-11
"Journal of Environmental Geology","NAhttps://www.pulsus.com/journal-environmental-geology.html","Pulsus Group",2022-08-11
"Journal of Endocrine Disorders & Surgery","NAhttps://www.pulsus.com/journal-endocrine-disorders-surgery.html","Pulsus Group",2022-08-11
"Journal of Environmental Microbiology","NAhttps://www.pulsus.com/journal-environmental-microbiology.html","Pulsus Group",2022-08-11
"Journal of Emerging Diseases and Preventive Medicine","NAhttps://www.pulsus.com/journal-emerging-diseases-preventive-medicine.html","Pulsus Group",2022-08-11
"Journal of Experimental and Clinical Microbiology","NAhttps://www.pulsus.com/journal-experimental-clinical-microbiology.html","Pulsus Group",2022-08-11
"Journal of Food and Clinical Nutrition","NAhttps://www.pulsus.com/journal-food-clinical-nutrition.html","Pulsus Group",2022-08-11
"Journal of Food and Drug Research","NAhttps://www.pulsus.com/journal-food-drug-research.html","Pulsus Group",2022-08-11
"General Surgery: Open Access","NAhttps://www.pulsus.com/general-surgery.html","Pulsus Group",2022-08-11
"Journal of Genetic Disorders and Genetic Medicine","NAhttps://www.pulsus.com/journal-genetic-disorders-genetic-medicine.html","Pulsus Group",2022-08-11
"Journal of Hematology and Clinical Therapeutics","NAhttps://www.pulsus.com/journal-hematology-clinical-therapeutics.html","Pulsus Group",2022-08-11
"Journal of Hepato-Gastroenterology","NAhttps://www.pulsus.com/journal-hepatogastroenterology.html","Pulsus Group",2022-08-11
"Journal of Heart Research","NAhttps://www.pulsus.com/journal-heart-research.html","Pulsus Group",2022-08-11
"Journal of Health Policy and Management","NAhttps://www.pulsus.com/journal-health-policy-management.html","Pulsus Group",2022-08-11
"Histology and Histopathology Research","NAhttps://www.pulsus.com/histology-histopathology-research.html","Pulsus Group",2022-08-11
"International Journal of Anatomical Variations","NAhttps://www.pulsus.com/international-journal-anatomical-variations.html","Pulsus Group",2022-08-11
"Journal of Immune Disorders & Therapy","NAhttps://www.pulsus.com/journal-immune-disorders-therapy.html","Pulsus Group",2022-08-11
"International Journal of HIV and AIDS Research","NAhttps://www.pulsus.com/international-journal-hiv-aids-research.html","Pulsus Group",2022-08-11
"Journal of Kidney Treatment and Diagnosis","NAhttps://www.pulsus.com/journal-kidney-treatment-diagnosis.html","Pulsus Group",2022-08-11
"Journal of Modern and Applied Physics","NAhttps://www.pulsus.com/journal-modern-applied-physics.html","Pulsus Group",2022-08-11
"Journal of Microbiology and Biotechnology Reports","NAhttps://www.pulsus.com/journal-microbiology-biotechnology-reports.html","Pulsus Group",2022-08-11
"Journal of Materials Engineering and Applications","NAhttps://www.pulsus.com/journal-material-science-engineering-applications.html","Pulsus Group",2022-08-11
"Journal of Molecular Cancer","NAhttps://www.pulsus.com/journal-molecular-cancer.html","Pulsus Group",2022-08-11
"Medical Toxicology: Current Research","NAhttps://www.pulsus.com/medical-toxicology.html","Pulsus Group",2022-08-11
"Nanotechnology Letters","NAhttps://www.pulsus.com/nanotechnology-letters.html","Pulsus Group",2022-08-11
"Neurodevelopmental Disorders and Treatment","NAhttps://www.pulsus.com/journal-neurodevelopmental-disorders-treatment.html","Pulsus Group",2022-08-11
"Journal of Neurology and Clinical Neuroscience","NAhttps://www.pulsus.com/journal-neurology-clinical-neuroscience.html","Pulsus Group",2022-08-11
"Journal of Nursing Research and Practice","NAhttps://www.pulsus.com/journal-nursing-research-practice.html","Pulsus Group",2022-08-11
"Journal of Nanoscience and Nanomedicine","NAhttps://www.pulsus.com/journal-nanoscience-nanomedicine.html","Pulsus Group",2022-08-11
"Journal of Neuropathology","NAhttps://www.pulsus.com/journal-neuropathology.html","Pulsus Group",2022-08-11
"Journal of Phlebology and Lymphology","NAhttps://www.pulsus.com/journal-phlebology-lymphology.html","Pulsus Group",2022-08-11
"Journal of Pure and Applied Mathematics","NAhttps://www.pulsus.com/journal-pure-applied-mathematics.html","Pulsus Group",2022-08-11
"Journal of Pulmonology","NAhttps://www.pulsus.com/journal-pulmonology.html","Pulsus Group",2022-08-11
"Journal of Pediatric Health Care and Medicine","NAhttps://www.pulsus.com/journal-pediatric-health-care-medicine.html","Pulsus Group",2022-08-11
"Journal of Pharmacology and Medicinal Chemistry","NAhttps://www.pulsus.com/journal-pharmacology-medicinal-chemistry.html","Pulsus Group",2022-08-11
"Journal of Pharmacology Research","NAhttps://www.pulsus.com/journal-pharmacology-research.html","Pulsus Group",2022-08-11
"Pulsus Journal of Surgical Research","NAhttps://www.pulsus.com/pulsus-journal-surgical-research.html","Pulsus Group",2022-08-11
"Journal of Pharmaceutical Chemistry and Pharmacology","NAhttps://www.pulsus.com/journal-pharmaceutical-chemistry-pharmacology.html","Pulsus Group",2022-08-11
"Psychiatry and Mental Health Research","NAhttps://www.pulsus.com/psychiatry-mental-health-research.html","Pulsus Group",2022-08-11
"Journal of Pathobiology and Physiology","NAhttps://www.pulsus.com/journal-pathobiology-physiology.html","Pulsus Group",2022-08-11
"Journal of Plant Biology and Agriculture Sciences","NAhttps://www.pulsus.com/journal-plant-biology-agriculture-sciences.html","Pulsus Group",2022-08-11
"Pediatric Urology Case Reports","NAhttps://www.pediatricurologycasereports.com/","Pulsus Group",2022-08-11
"Journal of Reproductive Biology and Endocrinology","NAhttps://www.pulsus.com/journal-reproductive-biology-endocrinology.html","Pulsus Group",2022-08-11
"Journal of Sexual & Reproductive Medicine","NAhttps://www.pulsus.com/sexual-reproductive-medicine.html","Pulsus Group",2022-08-11
"Surgery: Case Report","NAhttps://www.pulsus.com/surgery-case-report.html","Pulsus Group",2022-08-11
"Journal of Skin","NAhttps://www.pulsus.com/journal-skin.html","Pulsus Group",2022-08-11
"The Neurosurgery Journal","NAhttps://www.pulsus.com/the-neurosurgery-journal.html","Pulsus Group",2022-08-11
"The Ophthalmologist: Clinical and Therapeutic Journal","NAhttps://www.pulsus.com/ophthalmologist-clinical-therapeutic-journal.html","Pulsus Group",2022-08-11
"Journal of Veterinary Research and Medicine","NAhttps://www.pulsus.com/journal-veterinary-research-medicine.html","Pulsus Group",2022-08-11
